{
  "$schema": "../../../schemas/author.schema.json",
  "schema_version": 1,
  "id": "joseph-nguyen",
  "type": "author",
  "name": "Joseph Nguyen",
  "alternate_names": [],
  "profile": {
    "one_line": {
      "text": "A self-published writer who turns ideas from philosophy, spirituality and psychology into short, accessible books about overthinking and inner peace.",
      "source_ids": ["sands-author", "author-site"],
      "basis": "synthesis"
    },
    "biography": {
      "text": "Nguyen says his work grew from his own experience of overthinking and a wish to help readers find peace. He first published Don't Believe Everything You Think independently in 2022; its online word of mouth led to bestseller status and a later expanded edition from Authors Equity. His publisher says his work has reached millions of readers and more than forty languages. Public biographies focus on his writing and teaching rather than his early life.",
      "source_ids": ["year-mental-health", "sands-author", "author-site"],
      "basis": "synthesis"
    },
    "background": {
      "text": "Nguyen describes himself as a writer, teacher and speaker. He draws openly from philosophy, spirituality and psychology, but writes in plain, personal language rather than as a scholar or clinician. In 2025 he was named a NAMI ambassador.",
      "source_ids": ["sands-author", "author-site", "getabstract-review"],
      "basis": "synthesis"
    },
    "expertise": {
      "text": "His demonstrated expertise is in explaining contemplative self-help ideas to a broad audience. Independent coverage reports no formal training in psychology or philosophy, so claims about mental health should be judged as personal guidance, not clinical authority.",
      "source_ids": ["getabstract-review", "sands-author"],
      "basis": "synthesis"
    },
    "perspective_and_limits": {
      "text": "Nguyen writes as someone sharing what helped him. That gives his work warmth and immediacy, but it also encourages broad conclusions from personal experience. His central thought-distancing move has recognised relatives in contemplative practice and psychology; the book does not provide evidence proportionate to its claim about all psychological suffering.",
      "source_ids": ["year-mental-health", "blvd-counseling-review", "getabstract-review"],
      "basis": "synthesis"
    }
  },
  "selected_works": [
    {
      "title": "Don't Believe Everything You Think",
      "year": 2022,
      "kind": "Book",
      "relationship": "His best-known book and the subject of this library entry.",
      "source_ids": ["sands-expanded-edition"]
    },
    {
      "title": "Beyond Thoughts",
      "year": 2022,
      "kind": "Poetry collection",
      "relationship": "Continues his themes of self-observation, difficult emotion and identity beyond thought.",
      "source_ids": ["author-books"]
    },
    {
      "title": "The Overthinker's Guide to Making Decisions",
      "year": 2025,
      "kind": "Book",
      "relationship": "A companion guide that applies his approach to indecision and analysis paralysis.",
      "source_ids": ["sands-decisions"]
    }
  ],
  "research": {
    "sources": [
      {
        "id": "sands-author",
        "title": "Joseph Nguyen",
        "author_or_publisher": "Simon & Schuster",
        "url": "https://www.simonandschuster.biz/authors/Joseph-Nguyen/227509213",
        "type": "publisher",
        "accessed_at": "2026-08-13",
        "supports": "Current publisher biography, stated influences, translation reach and 2025 NAMI ambassador role.",
        "independence": "interested",
        "quality": "high",
        "limitations": "Publisher biography and marketing copy."
      },
      {
        "id": "sands-expanded-edition",
        "title": "Don't Believe Everything You Think (Expanded Edition)",
        "author_or_publisher": "Simon & Schuster",
        "url": "https://www.simonandschuster.com/books/Dont-Believe-Everything-You-Think-%28Expanded-Edition%29/Joseph-Nguyen/Books-By-Joseph-Nguyen/9798893310153",
        "type": "publisher",
        "accessed_at": "2026-08-13",
        "supports": "Publication history, expanded-edition identity and publisher account of the book's reach.",
        "independence": "interested",
        "quality": "high",
        "limitations": "Official product page."
      },
      {
        "id": "sands-decisions",
        "title": "The Overthinker's Guide to Making Decisions",
        "author_or_publisher": "Simon & Schuster",
        "url": "https://www.simonandschuster.com/books/The-Overthinkers-Guide-to-Making-Decisions/Joseph-Nguyen/Books-By-Joseph-Nguyen/9798893310665",
        "type": "publisher",
        "accessed_at": "2026-08-13",
        "supports": "Title, publication date, scope and relationship of Nguyen's 2025 companion book.",
        "independence": "interested",
        "quality": "high",
        "limitations": "Official product page."
      },
      {
        "id": "author-site",
        "title": "Joseph Nguyen",
        "author_or_publisher": "Joseph Nguyen",
        "url": "https://josephnguyen.org/",
        "type": "author",
        "accessed_at": "2026-08-13",
        "supports": "The author's description of his work, role and aims.",
        "independence": "interested",
        "quality": "medium",
        "limitations": "Self-description and sales copy."
      },
      {
        "id": "author-books",
        "title": "Joseph Nguyen's Books",
        "author_or_publisher": "Joseph Nguyen",
        "url": "https://josephnguyen.org/collections/books",
        "type": "author",
        "accessed_at": "2026-08-13",
        "supports": "Current list of books and their stated subjects.",
        "independence": "interested",
        "quality": "medium",
        "limitations": "Author storefront."
      },
      {
        "id": "year-mental-health",
        "title": "Joseph Nguyen Interview",
        "author_or_publisher": "Year of Mental Health",
        "url": "https://www.yearofmentalhealth.com/p/joseph-nguyen-interview",
        "type": "interview",
        "accessed_at": "2026-08-13",
        "supports": "Nguyen's account of the book's origin, self-publishing route and theory of thought.",
        "independence": "independent",
        "quality": "medium",
        "limitations": "Interview; the author's own claims are not independently tested."
      },
      {
        "id": "getabstract-review",
        "title": "Don't Believe Everything You Think",
        "author_or_publisher": "getAbstract",
        "url": "https://www.getabstract.com/en/summary/dont-believe-everything-you-think/49566",
        "type": "secondary-summary",
        "accessed_at": "2026-08-13",
        "supports": "Independent account of Nguyen's background, influences and lack of formal training in psychology or philosophy.",
        "independence": "independent",
        "quality": "medium",
        "limitations": "Brief commercial summary."
      },
      {
        "id": "blvd-counseling-review",
        "title": "Book Summary and Review: Don't Believe Everything You Think",
        "author_or_publisher": "BLVD Counseling",
        "url": "https://www.blvdcounseling.com/post/book-summary-and-review-don-t-believe-everything-you-think-by-joseph-nguyen",
        "type": "professional-review",
        "accessed_at": "2026-08-13",
        "supports": "A clinician's balanced assessment of the approach, its psychological relatives and its limits.",
        "independence": "independent",
        "quality": "medium",
        "limitations": "Practice blog, not peer-reviewed research."
      }
    ],
    "citations": {
      "/name": ["sands-author"]
    }
  },
  "workflow": {
    "status": "complete",
    "coverage_notes": "Profile checked against current publisher and author records, an interview and two independent assessments; private early-life details are omitted.",
    "last_researched": "2026-08-13",
    "next_steps": []
  }
}
