{
  "$schema":"../../../schemas/author.schema.json","schema_version":1,"id":"dan-heath","type":"author","name":"Dan Heath","alternate_names":[],
  "profile":{
    "one_line":{"text":"Business writer, case developer, and former Duke social-entrepreneurship fellow who turns research and organisational cases into practical frameworks.","source_ids":["duke-profile","publisher-profile"],"basis":"synthesis"},
    "biography":{"text":"Heath earned a bachelor's degree from the University of Texas Plan II programme and an MBA from Harvard Business School. He worked as a researcher and case writer at Harvard Business School, co-founded the educational publisher Thinkwell, and founded the Change Academy while affiliated with Duke's Center for the Advancement of Social Entrepreneurship.","source_ids":["duke-profile"],"basis":"synthesis"},
    "background":{"text":"His work combines reporting, cases, interviews, and behavioural research. With Chip Heath he wrote Made to Stick, Switch, Decisive, and The Power of Moments; his later solo work includes Upstream, Reset, and a podcast about different occupations.","source_ids":["duke-profile","publisher-profile"],"basis":"synthesis"},
    "expertise":{"text":"Dan Heath's strongest direct expertise is explaining ideas, developing teaching cases, entrepreneurship education, publishing, and practical organisational change. He is not presented as an experimental psychologist; the scientific authority in the books comes from the research they interpret, not from his biography.","source_ids":["duke-profile","peak-end-paper"],"basis":"synthesis"},
    "perspective_and_limits":{"text":"His case-writing skill produces vivid, usable examples but selects successes after their outcomes are known. Readers should treat the cases as pattern illustrations and test interventions locally, especially when designed moments involve vulnerable people, employee labour, or commercial persuasion.","source_ids":["duke-profile","publishers-weekly","goodreads-reception"],"basis":"inference"}
  },
  "selected_works":[
    {"title":"Made to Stick","year":2007,"kind":"Book","relationship":"Co-authored framework for memorable ideas.","source_ids":["duke-profile"]},
    {"title":"Switch","year":2010,"kind":"Book","relationship":"Co-authored framework for behavioural and organisational change.","source_ids":["duke-profile"]},
    {"title":"Decisive","year":2013,"kind":"Book","relationship":"Co-authored decision process.","source_ids":["duke-profile"]},
    {"title":"The Power of Moments","year":2017,"kind":"Book","relationship":"Co-authored framework for shaping memorable, meaningful experiences.","source_ids":["publisher-profile"]},
    {"title":"Upstream","year":2020,"kind":"Book","relationship":"Later solo book on preventing problems before they recur.","source_ids":["publisher-profile"]}
  ],
  "research":{"sources":[
    {"id":"duke-profile","title":"Dan Heath","author_or_publisher":"CASE at Duke, Fuqua School of Business","url":"https://centers.fuqua.duke.edu/case/team-profiles/dan-heath/","type":"employer","independence":"interested","quality":"high","accessed_at":"2026-08-13","supports":"Education, Harvard case work, Thinkwell, Duke Change Academy, and co-authored books.","limitations":"Institutional profile reflecting an earlier affiliation."},
    {"id":"publisher-profile","title":"The Power of Moments","author_or_publisher":"Simon & Schuster","url":"https://www.simonandschuster.com/books/The-Power-of-Moments/Chip-Heath/9781501147760","type":"publisher","independence":"interested","quality":"high","accessed_at":"2026-08-13","supports":"Current author biography, books, podcast, and co-authorship.","limitations":"Promotional publisher biography."},
    {"id":"peak-end-paper","title":"When More Pain Is Preferred to Less: Adding a Better End","author_or_publisher":"Kahneman et al.; Psychological Science","url":"https://journals.sagepub.com/doi/10.1111/j.1467-9280.1993.tb00589.x","type":"specialist-review","independence":"independent","quality":"high","accessed_at":"2026-08-13","supports":"Independent research scope behind the book's opening memory claim.","limitations":"Not biographical evidence."},
    {"id":"publishers-weekly","title":"The Power of Moments","author_or_publisher":"Publishers Weekly","url":"https://www.publishersweekly.com/9781501147760","type":"professional-review","independence":"independent","quality":"high","accessed_at":"2026-08-13","supports":"Independent assessment of applied cases and missing authenticity discussion.","limitations":"Short review."},
    {"id":"goodreads-reception","title":"The Power of Moments","author_or_publisher":"Goodreads","url":"https://www.goodreads.com/en/book/show/34466952-the-power-of-moments","type":"reader-aggregate","independence":"community","quality":"medium","accessed_at":"2026-08-13","supports":"Reader response to the authors' accessibility and case-driven style.","limitations":"Self-selected community data."}
  ],"citations":{"/name":["duke-profile","publisher-profile"],"/alternate_names":[]}},
  "workflow":{"status":"complete","coverage_notes":"Duke and publisher records establish education and professional work; independent review clarifies the limits of a case-driven synthesis.","last_researched":"2026-08-13","next_steps":[]}
}
